<!-- curriculumVitae.dtd grupo05 -->
<!ELEMENT curriculumVitae (contenido)>
<!ELEMENT contenido (left_Side,right_Side)>
<!ATTLIST right_Side titulo CDATA #REQUIRED >

<!ELEMENT left_Side (fotografia, formacionesAcademicas, contacto)>
<!ELEMENT right_Side (datosPersonales, experienciaLaborales, competencias, referencias)>
<!ATTLIST experienciaLaborales titulo CDATA #REQUIRED >
<!ATTLIST competencias titulo CDATA #REQUIRED >
<!ATTLIST referencias titulo CDATA #REQUIRED >
<!ATTLIST datosPersonales name CDATA #REQUIRED >

<!ELEMENT fotografia (foto)>
<!ELEMENT foto (#PCDATA)>

<!ELEMENT datosPersonales (nombre+, apellido+, edad, dui, nit, isss, afp)>
<!ELEMENT nombre (#PCDATA) >
<!ATTLIST nombre name CDATA #IMPLIED>
<!ATTLIST nombre tipo (primero|segundo) #REQUIRED>
<!ELEMENT apellido (#PCDATA) >
<!ATTLIST apellido tipo (primero|segundo) #REQUIRED>
<!ELEMENT edad (#PCDATA) >
<!ATTLIST edad identificador CDATA #REQUIRED >
<!ELEMENT dui (#PCDATA) >
<!ATTLIST dui identificador CDATA #REQUIRED >
<!ELEMENT nit (#PCDATA) >
<!ATTLIST nit identificador CDATA #REQUIRED >
<!ELEMENT isss (#PCDATA) >
<!ATTLIST isss identificador CDATA #REQUIRED >
<!ELEMENT afp (#PCDATA) >
<!ATTLIST afp identificador CDATA #REQUIRED >

<!ELEMENT contacto (celular+, telefono?, correo?)>
<!ELEMENT celular (#PCDATA) >
<!ELEMENT telefono (#PCDATA) >
<!ELEMENT correo (#PCDATA) >

<!ELEMENT formacionesAcademicas (formacionAcademica)+ >
<!ELEMENT formacionAcademica (institucionEducativa, tituloAcademico, periodoE)>
<!ATTLIST formacionAcademica id CDATA #REQUIRED>
<!ELEMENT institucionEducativa (#PCDATA) >
<!ELEMENT tituloAcademico (#PCDATA) >
<!ELEMENT periodoE (#PCDATA) >

<!ELEMENT experienciaLaborales (experienciaLaboral)+ >
<!ELEMENT experienciaLaboral (institucionLaboral, cargo+, periodo)>
<!ATTLIST experienciaLaboral id CDATA #REQUIRED>
<!ELEMENT institucionLaboral (#PCDATA) >
<!ELEMENT cargo (#PCDATA) >
<!ELEMENT periodo (#PCDATA) >

<!ELEMENT competencias (competencia)+>
<!ATTLIST competencia id CDATA #REQUIRED>
<!ELEMENT competencia (tituloC, descripcion)>
<!ELEMENT tituloC (#PCDATA) >
<!ELEMENT descripcion (#PCDATA) >

<!ELEMENT referencias (referencia)+>
<!ELEMENT referencia (nombreR+, apellidoR+, institucionLaboralR, telefonoR+)>
<!ATTLIST referencia id CDATA #REQUIRED>
<!ELEMENT nombreR (#PCDATA) >
<!ATTLIST nombreR tipo (primero|segundo) #REQUIRED>
<!ELEMENT apellidoR (#PCDATA) >
<!ATTLIST apellidoR tipo (primero|segundo) #REQUIRED>
<!ELEMENT institucionLaboralR (#PCDATA) >
<!ELEMENT telefonoR (#PCDATA) >
